mysql> insert into address_book (first_name, last_name, address, city, state, zip, phone_number, email) values
    -> ('Litu', 'Nath', 'Mebu', 'Pasighat', 'Arunachal pradesh', 791102, 8288894, 'litu@gmail.com');
Query OK, 1 row affected (0.00 sec)

mysql> select * from address_book;
+------------+-----------+---------+----------+-------------------+--------+--------------+------------------+
| first_name | last_name | address | city     | state             | zip    | phone_number | email            |
+------------+-----------+---------+----------+-------------------+--------+--------------+------------------+
| Shubom     | Nath      | Solung  | Pasighat | Arunachal pradesh | 791102 |      8288894 | shubom@gmail.com |
| Jyoti      | Nath      | Solung  | Pasighat | Arunachal pradesh | 791102 |      8974085 | jyoti@gmail.com  |
| Supali     | Nath      | Borbil  | Digboi   | Assam             | 758423 |      8974085 | supali@gmail.com |
| Litu       | Nath      | Mebu    | Pasighat | Arunachal pradesh | 791102 |      8288894 | litu@gmail.com   |
+------------+-----------+---------+----------+-------------------+--------+--------------+------------------+
4 rows in set (0.00 sec)

mysql> update address_book set phone_number = 9611058 where first_name = 'Litu'
    -> ;
Query OK, 1 row affected (0.01 sec)
Rows matched: 1  Changed: 1  Warnings: 0

mysql> select * from address_book;
+------------+-----------+---------+----------+-------------------+--------+--------------+------------------+
| first_name | last_name | address | city     | state             | zip    | phone_number | email            |
+------------+-----------+---------+----------+-------------------+--------+--------------+------------------+
| Shubom     | Nath      | Solung  | Pasighat | Arunachal pradesh | 791102 |      8288894 | shubom@gmail.com |
| Jyoti      | Nath      | Solung  | Pasighat | Arunachal pradesh | 791102 |      8974085 | jyoti@gmail.com  |
| Supali     | Nath      | Borbil  | Digboi   | Assam             | 758423 |      8974085 | supali@gmail.com |
| Litu       | Nath      | Mebu    | Pasighat | Arunachal pradesh | 791102 |      9611058 | litu@gmail.com   |
+------------+-----------+---------+----------+-------------------+--------+--------------+------------------+
4 rows in set (0.00 sec)

mysql>